Category,Title,Duration/Span,Placement,Core Idea,Audio Element,Inspired By
Episode Beat,The Unexpected Call,4 min,"Episode 1, early",The main character receives a mysterious call that sets the story in motion.,"Starts with ambient home sounds, phone ringing, then a tense conversation.",Layered Soundscapes (from The Notebook)
Episode Beat,A Mysterious Stranger,5 min,"Episode 1, mid",The main character meets a stranger who seems to know more than they let on.,Dialogue-driven with light background music and subtle sound effects.,Character Perspective Switches (from This Is Us)
Episode Beat,The Hidden Letter,7 min,"Episode 1, late",The main character discovers a hidden letter that reveals a long-buried secret.,"Narrator reading the letter with emotional inflection, followed by a reflective monologue.",Epistolary Structure (from The Guernsey Literary and Potato Peel Pie Society)
Episode Beat,The Midnight Walk,6 min,"Episode 2, early",The main character takes a midnight walk and stumbles upon a clue.,"Ambient night sounds, footsteps, and a sudden discovery.",Atmospheric Soundscapes (from The Crown)
Episode Beat,The Family Secret,5 min,"Episode 2, mid",The main character learns a family secret that changes everything.,"Tense dialogue with a reveal, followed by a reflective moment.",Layered Character Backstories (from The Crown)
Episode Beat,The Unexpected Visitor,4 min,"Episode 2, late","An unexpected visitor arrives, bringing more questions than answers.",Dialogue-driven with a mix of tense and curious tones.,Emotional Inflection (from Radiolab)
Episode Beat,The Lost Photo,6 min,"Episode 3, early",The main character finds an old photo that leads to new questions.,Narrative-driven with a focus on the photo and its significance.,Narrative Reflections (from The Fault in Our Stars)
Episode Beat,The Old Friend,5 min,"Episode 3, mid",The main character meets an old friend who provides a new perspective.,"Warm, nostalgic dialogue with a touch of mystery.",Character-Driven Dialogue (from S-Town)
Episode Beat,The Hidden Room,7 min,"Episode 3, late",The main character discovers a hidden room with clues to the mystery.,Suspenseful exploration with ambient sounds and a reveal.,Layered Storytelling (from S-Town)
Episode Beat,The Midnight Confession,5 min,"Episode 4, early",A character reveals a crucial piece of information in a late-night conversation.,"Intimate dialogue with a reveal, followed by a reflective moment.",Emotional Arcs (from The Crown)
Episode Beat,The Unexpected Ally,4 min,"Episode 4, mid",The main character finds an unexpected ally in their quest.,"Warm, supportive dialogue with a touch of excitement.",Character-Driven Transitions (from The Handmaid's Tale)
Episode Beat,The Final Clue,6 min,"Episode 4, late",The main character finds the final clue that solves the mystery.,"Suspenseful exploration with a reveal, followed by a reflective monologue.",Layered Voiceover (from The Handmaid's Tale)
Episode Beat,The Heartfelt Apology,5 min,"Episode 5, early","A character offers a heartfelt apology, leading to a moment of reconciliation.",Emotional dialogue with a focus on forgiveness.,Emotional Layering (from The Fault in Our Stars)
Episode Beat,The Unexpected Twist,7 min,"Episode 5, mid",The main character discovers that the mystery is more complex than they thought.,Narrative-driven with a series of revelations.,Layered Storytelling (from S-Town)
Episode Beat,The Final Confrontation,6 min,"Episode 5, late",The main character faces the person responsible for the mystery.,Tense dialogue with a climactic confrontation.,Emotional Crescendos (from The Nightingale)
Episode Beat,The New Beginning,5 min,"Episode 6, early",The main character finds a new sense of purpose after solving the mystery.,Reflective monologue with a focus on the future.,Emotional Arcs (from The Crown)
Episode Beat,The Unexpected Legacy,4 min,"Episode 6, mid",The main character discovers an unexpected legacy left by a loved one.,Narrative-driven with a focus on the legacy and its meaning.,Layered Character Backstories (from The Crown)
Episode Beat,The Final Reflection,6 min,"Episode 6, late",The main character reflects on their journey and the people who helped them.,Reflective monologue with voiceovers from supporting characters.,Layered Voiceover (from The Handmaid's Tale)
Episode Beat,The Unexpected Gift,5 min,"Episode 6, early",The main character receives an unexpected gift that symbolizes their growth.,Narrative-driven with a focus on the gift and its significance.,Emotional Layering (from The Fault in Our Stars)
Episode Beat,The Final Goodbye,4 min,"Episode 6, late","The main character says goodbye to a significant place or person, marking the end of their journey.",Reflective monologue with a focus on the farewell.,Narrative Reflections (from The Fault in Our Stars)
Season Arc,Whispers of the Past,Episodes 1-3,Episodes 1-3,"A woman discovers old letters that reveal her mother's hidden past, leading her to question her own identity and relationships.","Rustling of old paper, distant echo of a piano playing",Epistolary Structure (from The Guernsey Literary and Potato Peel Pie Society)
Season Arc,The Bridge Between Us,Episodes 2-4,Episodes 2-4,"Two estranged sisters reconnect after a family crisis, navigating their differences and shared history to rebuild their bond.","Echoes of childhood games, gentle laughter",Character Perspective Switches (from This Is Us)
Season Arc,Shadows of Doubt,Episodes 1-4,Episodes 1-4,"A journalist investigates a series of unexplained disappearances in her town, uncovering a web of secrets and lies.","Distant sirens, whispers, and faint footsteps",Layered Soundscapes (from The Nightingale)
Season Arc,Echoes of the Heart,Episodes 1-3,Episodes 1-3,"A man returns to his hometown to care for his ailing father, rediscovering his roots and the love he left behind.","Rustling leaves, chirping birds, and the distant sound of a river",Atmospheric Soundscapes (from The Crown)
Season Arc,The Weight of Silence,Episodes 2-4,Episodes 2-4,"A teacher grapples with the ethical implications of a student's secret, weighing her duty to protect versus her obligation to report.","Soft ticking of a clock, the sound of a heart beating",Emotional Arcs (from The Crown)
Season Arc,Threads of Connection,Episodes 1-3,Episodes 1-3,"A single mother and a widower form an unlikely friendship, finding support and companionship in each other's company.","Gentle laughter, the sound of children playing",Character-Driven Dialogue (from S-Town)
Season Arc,The Garden of Memories,Episodes 1-3,Episodes 1-3,"A woman inherits a mysterious garden from her grandmother and discovers its magical properties, leading to a journey of self-discovery and healing.","Rustling leaves, the sound of a gentle breeze, and the chirping of crickets",Atmospheric Soundscapes (from The Crown)
Season Arc,The Unseen Path,Episodes 2-4,Episodes 2-4,"A young woman with a hidden talent for art struggles to balance her passion with her responsibilities, leading to a transformative journey.","The sound of a paintbrush on canvas, the rustling of art supplies",Character-Driven Soundscapes (from The Fault in Our Stars)
Season Arc,The Heart's Compass,Episodes 1-3,Episodes 1-3,"A couple on the brink of separation goes on a road trip to rediscover their love, facing challenges that test their bond.","The sound of a car engine, the hum of the road, and distant music",Emotional Layering (from This Is Us)
Season Arc,The Secret Keeper,Episodes 2-4,Episodes 2-4,"A librarian discovers a hidden diary in an old book, leading her to uncover a decades-old mystery that could change her town's history.","The sound of pages turning, the creaking of old bookshelves",Character-Driven Transitions (from The Handmaid's Tale)
Series-Defining,The Mysterious Message,3 minutes,"Episode 1, during the introduction of Julia's daily routine","Julia, an overworked professional, receives an anonymous inspirational message that speaks directly to her struggles. The message is personal and profound, leaving her both intrigued and moved.","A gentle, soothing background of morning coffee brewing and soft, inspirational music",Emotional Voiceover Narration (from The Notebook)
Series-Defining,The Discovery,4 minutes,"Episode 3, during a pivotal moment in Tom's life","Tom, a struggling life coach, discovers that one of his motivational messages was accidentally sent to an unknown recipient. He decides to track down this person, driven by a sense of curiosity and a ","A mix of determined piano notes and the sound of a computer keyboard, with a slight tension in the b",Emotional Layering (from This Is Us)
Series-Defining,The Reveal,5 minutes,"Episode 5, during a critical moment in their relationship","Julia and Tom finally meet in person, and Julia reveals that she has been anonymously supporting Tom's coaching business. This full-circle moment is both emotional and transformative, deepening their ","A blend of gentle, uplifting music and the sound of a quiet, intimate setting",Emotional Arcs (from The Crown)
Series-Defining,The Turning Point,6 minutes,"Episode 4, during a moment of crisis","Julia faces a significant personal challenge at work, and Tom's messages provide the inspiration she needs to overcome her doubts and make a difficult decision. This moment highlights the power of sup","A mix of tense background sounds and a gentle, motivational melody",Emotional Inflection (from Radiolab)
Series-Defining,The Final Reflection,4 minutes,"Episode 6, during the conclusion of the series","In a reflective moment, Julia and Tom sit together, discussing the journey they've been on and the impact they've had on each other's lives. They share their gratitude and the lessons they've learned,","A gentle, reflective background of soft piano and the sound of a quiet, peaceful setting",Narrative Reflections (from The Fault in Our Stars)
