Category,Title,Duration/Span,Placement,Core Idea,Audio Element,Inspired By
Micro-Moment,First Lifeline Message,45 sec,"Episode 1, opening scene",Julia receives her first accidental motivational text from Tom during her lowest moment.,"Sound of a phone notification cutting through tense silence, followed by Tom's warm voice reading th",Natural Dialogue Flow
Micro-Moment,Morning Ritual Begins,60 sec,"Episode 2, mid-episode","Julia begins looking forward to Tom's daily messages, incorporating them into her morning routine.",Gentle morning sounds blending with Tom's voice becoming clearer each day.,Environmental Storytelling
Micro-Moment,ER Chaos Contrast,75 sec,"Episode 3, crisis scene",Julia reads Tom's calming message amidst the chaos of a critical emergency room situation.,Sudden transition from ER cacophony to the quiet moment of Julia reading the text.,Character Voice Signature
Micro-Moment,Tom's Creative Process,60 sec,"Episode 4, character development scene","Tom crafts personalized messages, revealing his thoughtful nature and dedication to helping others.","Sound of typing, coffee mug placement, and Tom's thoughtful voice as he composes messages.",Intimate Voice Portrayal
Micro-Moment,Dark Night Text,90 sec,"Episode 5, emotional climax",Julia receives a perfectly timed message from Tom during her darkest moment of despair.,"Sound of rain against window, heavy breathing, then the distinctive phone notification sound.",Emotional Micro-Storytelling
Micro-Moment,Client Complaint Revealed,45 sec,"Episode 6, turning point","Tom's actual client complains about never receiving messages, triggering his realization of the mistake.",Sharp contrast between the client's frustrated tone and Tom's confused reaction.,Distinct Voice Signatures
Micro-Moment,Digital Investigation,75 sec,"Episode 6, mid-episode","Tom meticulously tracks down Julia's information, growing increasingly concerned about the person who received his messages.",Keyboard typing sounds mixed with Tom's anxious voice and subtle heartbeat audio.,Internal Monologue Integration
Micro-Moment,Julia's Worst Day,60 sec,"Episode 7, opening scene",Julia experiences a catastrophic failure at work that triggers her deepest depression just before Tom finds her.,"Clinical hospital sounds abruptly cutting to dead silence, then Julia's ragged breathing.",Environmental Storytelling
Micro-Moment,First Real Encounter,90 sec,"Episode 7, climactic meeting","Tom and Julia meet in person for the first time at the hospital, creating an electric moment of recognition.","Sound of footsteps approaching, then a moment of stunned silence when they see each other.",Missed Connection Moment
Micro-Moment,Confession in Cafeteria,75 sec,"Episode 8, mid-episode","Julia confesses to Tom how his messages saved her life, revealing the depth of her depression.",Sound of a hospital cafeteria fading into background as Julia's voice becomes more intimate.,Natural Dialogue Flow
Micro-Moment,Shared Vulnerability,60 sec,"Episode 8, character development","Tom shares his own struggles with authenticity, revealing why he became a motivation coach.",Tom's voice breaking slightly as he reveals his personal history.,Character Voice Evolution
Micro-Moment,Intentional First Text,45 sec,"Episode 9, beginning of new relationship","Tom sends Julia his first intentional motivational message, marking the start of their real connection.",Distinctive notification sound followed by Julia's soft gasp of recognition.,Fateful Coincidence
Micro-Moment,Professional Collides,75 sec,"Episode 10, conflict scene",Julia's clinical detachment clashes with Tom's emotional approach during a medical emergency.,Sharp contrast between Julia's professional commands and Tom's supportive whispers.,Dual Storyline Differentiation
Micro-Moment,Midnight Realization,60 sec,"Episode 11, emotional turning point",Julia realizes she's fallen in love with Tom during a quiet moment of reflection.,"Sound of a clock ticking, then silence as the realization hits.",Internal Monologue Integration
Micro-Moment,Right Message Finally,90 sec,"Episode 12, concluding scene",Tom and Julia acknowledge their relationship has grown beyond the messages into genuine love.,Their voices blending in perfect harmony as they speak simultaneously.,Musical Emotional Expression
Micro-Moment,First Accidental Message,45 sec,"Episode 1, opening scene",Julia receives her first accidental inspirational text from Tom during a crisis at the hospital.,"Sound of phone notification cutting through chaotic ER sounds, followed by momentary silence as Juli",Missed Connection Moment (Serendipity)
Micro-Moment,Daily Lifeline Ritual,60 sec,"Episode 2, morning sequence","Julia begins her day by waiting for Tom's morning message, showing how it's become essential to her routine.","Sound of alarm clock, then silence as Julia reaches for her phone, followed by gentle notification c",Environmental Storytelling (Before Sunrise)
Micro-Moment,Tom's Creative Process,75 sec,"Episode 3, mid-episode","Tom crafts a particularly thoughtful message, revealing his genuine dedication to helping others.","Sound of typing on keyboard, punctuated by moments of contemplative silence",Internal Monologue Integration (Crazy Ex-Girlfriend)
Micro-Moment,Message Saves Julia,90 sec,"Episode 4, climactic moment","Julia receives a message at her lowest point, preventing her from making a devastating decision.","Sound of heavy rain against window, Julia's shaky breathing, then sharp phone notification cutting t",Musical Emotional Expression (Crazy Ex-Girlfriend)
Micro-Moment,Client Complaint,45 sec,"Episode 5, turning point","Tom's actual client complains about not receiving messages, causing him to investigate the error.",Sound of phone ringing with distinct business-like tone,Strategic Emotional Pacing (Jane the Virgin)
Micro-Moment,Discovery of Mistake,60 sec,"Episode 5, conclusion",Tom discovers he's been messaging a wrong number for a year and decides to find the recipient.,"Sound of frantic typing, followed by a sharp intake of breath",Character Voice Signature (The Holiday)
Micro-Moment,Julia's Worst Day,75 sec,"Episode 6, opening","Julia experiences a series of traumatic events at work, culminating in her breaking down alone.","Layered hospital sounds gradually becoming overwhelming, then sudden silence",Environmental Storytelling (Before Sunrise)
Micro-Moment,Tracking Down,60 sec,"Episode 6, mid-episode","Tom follows digital breadcrumbs to find Julia, showing his persistence and growing concern.",Sound of computer notifications and mouse clicks in rapid succession,Parallel Storyline Weaving (Love Actually)
Micro-Moment,First Meeting,90 sec,"Episode 7, climactic scene","Tom finds Julia at her lowest moment, and their first face-to-face meeting is emotionally charged.","Sound of approaching footsteps, then sudden silence as they see each other",Fateful Coincidence (Serendipity)
Micro-Moment,Realization of Impact,75 sec,"Episode 7, aftermath","Tom learns how his messages saved Julia's life, leaving him profoundly moved by their unintended connection.","Sound of Julia's shaky voice recounting her struggles, with moments of emotional silence",Natural Dialogue Flow (Before Sunrise)
Micro-Moment,Coffee Shop Confession,60 sec,"Episode 8, mid-episode","Julia and Tom meet again in a neutral setting, beginning to know each other beyond the messages.",Sound of coffee shop ambiance fading as their conversation becomes intimate,Intimate Voice Portrayal (Modern Love)
Micro-Moment,Shared Vulnerability,75 sec,"Episode 9, emotional turning point","Tom shares his own struggles with depression, revealing he sends messages he himself needs to hear.",Sound of Tom's voice cracking slightly as he reveals his truth,Character Voice Evolution (This Is Us)
Micro-Moment,Hospital Emergency,60 sec,"Episode 10, crisis moment",Julia faces a critical situation at work when Tom unexpectedly arrives to offer support.,Sound of ER chaos interrupted by the familiar notification tone of Julia's phone,Dual Storyline Differentiation (The Holiday)
Micro-Moment,Intentional Message,45 sec,"Episode 11, tender moment","Tom sends Julia his first intentional message, marking the transition from accident to choice.","Sound of phone notification with a new, distinct tone, followed by Julia's gasp of recognition",Emotional Micro-Storytelling (Modern Love)
Micro-Moment,Morning Together,90 sec,"Episode 12, closing scene","Julia and Tom share a morning together, demonstrating their healed connection and mutual support.","Sound of morning birds, coffee brewing, and soft conversation blending together",Distinct Voice Signatures (Love Actually)
Episode Beat,Morning Motivation Mistake,4-6 min,"Episode 1, early","Tom sends his first motivational text to Julia instead of his client. Julia, in a deep depression, receives the message unexpectedly and feels a small spark of hope.","Split audio between Tom's bright, energetic home office and Julia's quiet, somber apartment. Text no",Parallel Storyline Weaving
Episode Beat,Life Saving Words,5-7 min,"Episode 2, mid","Julia shares via internal monologue how Tom's daily messages have become her lifeline during dark moments, specifically preventing a suicide attempt after an especially difficult shift at the hospital",Intimate close-mic narration with hospital ambient sounds fading into quiet apartment sounds. Text n,Internal Monologue Intimacy
Episode Beat,Growing Dependency,4-6 min,"Episode 3, mid","Julia begins to look forward to Tom's daily messages, changing her routine to ensure she never misses one. Tom starts crafting more personalized messages, sensing an unspoken connection.",Timeline audio differences showing passage of time through changing seasons in background sounds. Te,Timeline Audio Differentiation
Episode Beat,Professional Frustration,3-5 min,"Episode 4, early","Tom's actual client confronts him about never receiving the motivational messages she's paying for. Tom is confused but promises to investigate, showing his commitment to his work.",Office environment with clear voice distinction between Tom's calm professional tone and his client',Distinct Voice Signatures
Episode Beat,Error Discovery,4-6 min,"Episode 4, late",Tom reviews his message history and realizes he's been texting the wrong number for a year. He's horrified at his mistake but also curious about the anonymous recipient who never corrected him.,Close-mic narration with keyboard typing sounds and message notification alerts. Internal and extern,Internal Monologue Intimacy
Episode Beat,Hospital Horrors,5-7 min,"Episode 5, mid","Julia experiences the worst day of her career at the ER, losing multiple patients and questioning her life choices. She returns home emotionally broken, awaiting Tom's message.","Intense hospital sounds (monitors, urgent voices) fading into oppressive silence in her apartment. T",Environmental Storytelling
Episode Beat,Tracking Down Truth,4-6 min,"Episode 5, late","Tom debates whether to contact the wrong number, ultimately deciding he must apologize in person. He uses his professional resources to track down Julia's location.",Voice-over narration with computer search sounds and phone calls. Music builds as he makes his decis,Strategic Emotional Emphasis
Episode Beat,Unexpected Knock,5-7 min,"Episode 6, early","Tom arrives at Julia's apartment, surprising her. She's shocked to meet the person whose words have been her lifeline, while Tom is unprepared for her vulnerable state.",Door knock sound effect transitioning into face-to-face dialogue with distinct voice separation. Bac,Natural Dialogue Flow
Episode Beat,Lifeline Confession,6-8 min,"Episode 6, mid","Julia confesses how Tom's messages saved her life multiple times, including preventing a suicide attempt. Tom is deeply moved and struggles to process the impact of his mistaken texts.",Intimate close-mic dialogue with minimal background noise. Emotional pauses and breath sounds emphas,Intimate Voice Portrayal
Episode Beat,Professional Guilt,3-5 min,"Episode 6, late",Tom expresses guilt about neglecting his actual client while Julia internalizes the shame of not correcting the mistake. Both question their professional integrity.,Alternating internal monologues with overlapping thoughts. Subtle musical motif underscoring shared ,Missed Connection Moments
Episode Beat,Emergency Call,4-6 min,"Episode 7, early","Julia receives an emergency call requiring her to return to the hospital immediately. Tom offers to drive her, creating an unexpected continuation of their connection.","Ringing phone sound effect, urgent dialogue transition to car environment with road sounds and siren",Fateful Coincidence
Episode Beat,ER Observation,5-7 min,"Episode 7, mid","Tom waits in the ER and observes Julia in her professional element, gaining new respect for her work and the emotional toll it takes. He sees the person behind the depression.",Hospital waiting room sounds with Tom's internal narration. Occasional glimpses of Julia's professio,Environmental Storytelling
Episode Beat,Coffee Confession,5-7 min,"Episode 7, late","After her shift, Julia and Tom share coffee in the hospital cafeteria. They begin to open up about their personal struggles, finding common ground in their dedication to helping others.",Cafeteria ambient sounds with intimate close-mic dialogue. Coffee cups and background chatter create,Natural Dialogue Flow
Episode Beat,Message Continuation,4-6 min,"Episode 8, early","Tom offers to continue sending Julia motivational messages, but this time intentionally. Julia hesitantly agrees, acknowledging their positive impact while fearing dependency.",Quiet park environment with natural sounds. Dialogue flows with pauses showing emotional considerati,Character Voice Evolution
Episode Beat,Professional Resentment,4-6 min,"Episode 8, mid",Tom's actual client discovers his connection with Julia and expresses feeling neglected and betrayed. Tom must navigate repairing his professional relationship while maintaining his new personal one.,Office environment with tense phone call audio. Voice modulation shows Tom's internal struggle.,Strategic Emotional Emphasis
Episode Beat,ER Emergency,5-7 min,"Episode 9, early","Julia faces another traumatic day at the hospital, questioning her ability to continue. She breaks protocol by texting Tom for support during her shift.",Intense ER sounds with Julia's internal monologue and text notification sounds. Voice modulation sho,Internal Monologue Intimacy
Episode Beat,Impromptu Visit,4-6 min,"Episode 9, mid",Tom responds to Julia's text by showing up at the hospital with coffee and food. Julia is touched by his support but concerned about boundaries in her workplace.,Hospital waiting room sounds transitioning to quiet staff area. Distinct voice separation with emoti,Fateful Coincidence
Episode Beat,Vulnerability Shared,6-8 min,"Episode 10, mid",Julia opens up about the root of her depression following a patient loss years ago. Tom shares his own struggles with impostor syndrome and the pressure to always be motivational.,Quiet apartment setting with intimate close-mic dialogue. Minimal background sounds emphasize emotio,Intimate Voice Portrayal
Episode Beat,Professional Crossroads,4-6 min,"Episode 11, early",Tom faces a career dilemma when offered a high-profile position that would require relocating. He must choose between professional advancement and his growing connection with Julia.,Office environment with phone call sounds transitioning to internal monologue. Musical motif emphasi,Musical Emotional Expression
Episode Beat,Right Message Received,5-7 min,"Episode 12, late","Tom and Julia acknowledge their relationship has evolved beyond mistaken messages. They commit to exploring their connection consciously, choosing hope over isolation.",Sunset park environment with natural sounds. Dialogue flows with comfortable pauses and shared laugh,Emotional Micro-Storytelling
Season Arc,"Mistaken Messages, Lifeline Found",Episodes 1-3,Episodes 1-3,"We establish Julia's deep depression and the unexpected impact of Tom's misdirected messages. As her anonymous connection to Tom grows, we witness how these texts become her daily anchor, saving her f","Text notification sounds that gradually become more comforting, Julia's internal monologue becoming ",Internal Monologue Integration (Crazy Ex-Girlfriend)
Season Arc,Breaking the Digital Barrier,Episodes 3-5,Episodes 3-5,"Julia finally responds to one of Tom's messages, creating a dialogue between them. Their anonymous text relationship deepens as they begin to share more personal thoughts and feelings, with Tom believ","Text message sounds with distinct tones for each character, subtle keyboard typing sounds",Natural Dialogue Flow (Before Sunrise)
Season Arc,"Truth Revealed, Worlds Collide",Episodes 5-7,Episodes 5-7,"Tom's actual client confronts him about never receiving messages, leading him to discover his year-long mistake. He tracks down Julia's number and arranges to meet her, coincidentally on the worst day","Phone call sounds, hospital emergency room sounds, tense musical motifs",Missed Connection Moments (Serendipity)
Season Arc,From Deception to Authenticity,Episodes 6-8,Episodes 6-8,"Julia grapples with the guilt of her deception while Tom processes the shock of his mistake. They must navigate the difficult transition from anonymous text connection to real-life relationship, confr","Text message sounds transitioning to face-to-face dialogue, musical motifs representing trust buildi",Character Voice Evolution (This Is Us)
Season Arc,Healing Through Connection,Episodes 7-9,Episodes 7-9,"As Tom and Julia navigate their new relationship, they each confront their personal demons. Julia faces her depression with Tom's support, while Tom examines his own vulnerabilities as a motivation co","Therapy session sounds, journal writing audio, musical motifs representing healing",Intimate Voice Portrayal (Modern Love)
Season Arc,"Past Shadows, Present Light",Episodes 8-10,Episodes 8-10,"As their relationship deepens, Tom and Julia must confront past relationships and experiences that shaped their current struggles. Julia revisits a failed relationship that contributed to her depressi","Flashback audio effects, distinct musical themes for past and present",Timeline Audio Differences (This Is Us)
Season Arc,Professional Crossroads,Episodes 9-11,Episodes 9-11,Both Tom and Julia face critical professional challenges that test their relationship and personal growth. Julia must decide whether to continue in her high-stress ER career or pursue a new path in me,"Hospital sounds, office environment sounds, phone call audio transitions",Environmental Storytelling (Before Sunrise)
Season Arc,Weathering the Storm Together,Episodes 10-12,Episodes 10-12,"Just as their relationship finds solid ground, external threats emerge that test their bond. Julia faces a medical crisis that puts her career in jeopardy, while Tom must deal with a family emergency ","Phone call sounds, hospital sounds, distinct locations marked by audio signatures",Parallel Storyline Weaving (Love Actually)
Season Arc,The Power of Words Spoken,Episodes 11-12,Episodes 11-12,"As their individual crises resolve, Tom and Julia must decide the future of their relationship. They reflect on the journey from anonymous texts to deep connection, acknowledging both the deception th","Text message sounds transitioning to intimate conversation, shared musical motifs",Natural Dialogue Flow (Before Sunrise)
Season Arc,"Wrong Number, Right Direction",Episode 12,Episode 12,"In the season finale, Tom and Julia make decisive choices about their future together. Julia finds a new direction in medicine that aligns with her healed self, while Tom transforms his coaching pract","Full circle callback to text notification sounds, evolved musical motifs",Musical Emotional Expression (Crazy Ex-Girlfriend)
Series-Defining,Message in a Digital Bottle,4-5 minutes,"Episode 1, opening scene","The series opens with Julia in her apartment, surrounded by darkness, contemplating ending her life. Her phone buzzes with an incoming text from an unknown number. We hear the text read in Tom's warm,","The contrast between Julia's silent, heavy breathing and Tom's warm, resonant voice reading the text",Environmental Storytelling (Before Sunrise)
Series-Defining,"Code Blue, Text Received",6-7 minutes,"Episode 5, midpoint","Julia faces her most challenging ER shift yet - a multiple casualty incident with a critically injured child. As she struggles to maintain composure under extreme pressure, her phone buzzes with Tom's","Cross-cutting between the chaotic ER sounds (beeping monitors, urgent medical commands, frantic move",Missed Connection Moment (Serendipity)
Series-Defining,"Wrong Number, Right Door",8-10 minutes,"Episode 8, climax","Tom tracks down Julia's address to apologize for the texting mistake. When he arrives, he finds Julia on the worst day of her life - she's just been suspended from work after a medical error. Their in","The sound of the doorbell, followed by a tense silence. The voices start formal and distant, then gr",Natural Dialogue Flow (Before Sunrise)
Series-Defining,Confessions Through Static,7-8 minutes,"Episode 10, post-climax","After their initial meeting, Tom and Julia attempt to navigate their new reality. In this scene, they have their first intentional phone conversation. The audio alternates between clear dialogue and m",Alternating clear dialogue and phone static/interference. The moments of vulnerability often occur d,Internal Monologue Integration (Crazy Ex-Girlfriend)
Series-Defining,"Right Number, Right Time",5-6 minutes,"Episode 12, series finale","One year after their first meeting, Tom and Julia stand together looking at holiday lights. Julia receives a text notification, but instead of reading it, she simply smiles and puts her phone away. To","The sound of a phone notification, followed by the ambient sounds of people enjoying holiday lights.",Emotional Micro-Storytelling (Modern Love)
